{
  "case_id": "desirebalance-demo-001",
  "title": "Multi-actor prosperity and anti-involution demonstration",
  "purpose_contract": {
    "goal": "Expand demand and innovation without converting social security, dignity and identity into endless rank competition.",
    "value": "Prosperity, autonomy, capability, durable wellbeing and fair participation.",
    "constraints": [
      "No punitive individual scoring",
      "No covert manipulation",
      "No forced consumption",
      "No automated employment, credit or welfare decision"
    ],
    "time_window": "12-month pilot with quarterly review",
    "feedback_plan": "Publish aggregate outcomes, distributional impacts, residuals and exit conditions."
  },
  "desire_items": [
    {
      "desire_id": "d1",
      "actor_id": "person-a",
      "actor_type": "individual",
      "name": "Skills and health investment",
      "description": "Spend on vocational learning, preventive health, exercise and recovery.",
      "category": "capability",
      "intensity": 0.74,
      "autonomy": 0.88,
      "basic_need_relevance": 0.68,
      "capability_gain": 0.91,
      "relational_gain": 0.55,
      "innovation_spillover": 0.62,
      "wellbeing_durability": 0.86,
      "reversibility": 0.78,
      "evidence_strength": 0.72,
      "positionality": 0.18,
      "manipulation_pressure": 0.12,
      "debt_burden": 0.14,
      "time_burden": 0.35,
      "ecological_externality": 0.12,
      "third_party_externality": 0.08
    },
    {
      "desire_id": "d2",
      "actor_id": "household-b",
      "actor_type": "household",
      "name": "Prestige education arms race",
      "description": "Escalating tutoring and credential purchases mainly to avoid falling behind neighbors.",
      "category": "positional_education",
      "intensity": 0.91,
      "autonomy": 0.38,
      "basic_need_relevance": 0.42,
      "capability_gain": 0.48,
      "relational_gain": 0.18,
      "innovation_spillover": 0.16,
      "wellbeing_durability": 0.24,
      "reversibility": 0.35,
      "evidence_strength": 0.52,
      "positionality": 0.92,
      "manipulation_pressure": 0.74,
      "debt_burden": 0.68,
      "time_burden": 0.88,
      "ecological_externality": 0.15,
      "third_party_externality": 0.66
    },
    {
      "desire_id": "d3",
      "actor_id": "company-c",
      "actor_type": "organization",
      "name": "Product quality and shared innovation",
      "description": "Invest in quality, safety, worker learning and reusable knowledge rather than only sales ranking.",
      "category": "productive_growth",
      "intensity": 0.82,
      "autonomy": 0.78,
      "basic_need_relevance": 0.36,
      "capability_gain": 0.87,
      "relational_gain": 0.68,
      "innovation_spillover": 0.90,
      "wellbeing_durability": 0.70,
      "reversibility": 0.64,
      "evidence_strength": 0.66,
      "positionality": 0.25,
      "manipulation_pressure": 0.18,
      "debt_burden": 0.33,
      "time_burden": 0.52,
      "ecological_externality": 0.28,
      "third_party_externality": 0.20
    },
    {
      "desire_id": "d4",
      "actor_id": "platform-d",
      "actor_type": "platform",
      "name": "High-frequency purchase conversion",
      "description": "Use countdowns, streak loss, infinite scroll and inferred intention bidding to maximize purchases.",
      "category": "captured_consumption",
      "intensity": 0.95,
      "autonomy": 0.12,
      "basic_need_relevance": 0.08,
      "capability_gain": 0.10,
      "relational_gain": 0.08,
      "innovation_spillover": 0.30,
      "wellbeing_durability": 0.06,
      "reversibility": 0.22,
      "evidence_strength": 0.70,
      "positionality": 0.76,
      "manipulation_pressure": 0.98,
      "debt_burden": 0.56,
      "time_burden": 0.78,
      "ecological_externality": 0.52,
      "third_party_externality": 0.82
    },
    {
      "desire_id": "d5",
      "actor_id": "city-e",
      "actor_type": "policy",
      "name": "Public service and cultural consumption expansion",
      "description": "Expand accessible care, sports, libraries, cultural services and vocational mobility.",
      "category": "public_capability",
      "intensity": 0.78,
      "autonomy": 0.70,
      "basic_need_relevance": 0.82,
      "capability_gain": 0.88,
      "relational_gain": 0.78,
      "innovation_spillover": 0.58,
      "wellbeing_durability": 0.84,
      "reversibility": 0.61,
      "evidence_strength": 0.60,
      "positionality": 0.12,
      "manipulation_pressure": 0.10,
      "debt_burden": 0.34,
      "time_burden": 0.26,
      "ecological_externality": 0.25,
      "third_party_externality": 0.12
    }
  ],
  "competition_contexts": [
    {
      "context_id": "c1",
      "name": "Household education tournament",
      "actor_type": "household",
      "relative_rank_dependence": 0.92,
      "winner_take_all": 0.78,
      "effort_escalation": 0.90,
      "marginal_return_decline": 0.84,
      "forced_visibility": 0.72,
      "rule_opacity": 0.62,
      "exit_barrier": 0.78,
      "duplicated_effort": 0.70,
      "price_war_pressure": 0.22,
      "safety_externality": 0.28
    },
    {
      "context_id": "c2",
      "name": "Organization overtime and ranking tournament",
      "actor_type": "organization",
      "relative_rank_dependence": 0.82,
      "winner_take_all": 0.72,
      "effort_escalation": 0.91,
      "marginal_return_decline": 0.78,
      "forced_visibility": 0.68,
      "rule_opacity": 0.55,
      "exit_barrier": 0.69,
      "duplicated_effort": 0.80,
      "price_war_pressure": 0.62,
      "safety_externality": 0.45
    },
    {
      "context_id": "c3",
      "name": "Community capability expansion",
      "actor_type": "community",
      "relative_rank_dependence": 0.18,
      "winner_take_all": 0.16,
      "effort_escalation": 0.22,
      "marginal_return_decline": 0.30,
      "forced_visibility": 0.14,
      "rule_opacity": 0.24,
      "exit_barrier": 0.28,
      "duplicated_effort": 0.20,
      "price_war_pressure": 0.10,
      "safety_externality": 0.12
    }
  ]
}
